{
  "$schema": "https://json-schema.org/draft/2020-12/schema",
  "$id": "https://openvaluesstandard.org/schema/register-coverage-rules-v1.schema.json",
  "title": "Open Values Register Coverage Rules",
  "description": "Hand-reviewed rules saying which catalogue decisions each public register can supply facts for. Maintainers write them, and the coverage matrix builder applies them; any pair no rule covers stays marked as not yet reviewed.",
  "type": "object",
  "required": ["format", "version", "updated", "note", "statusDefinitions", "registers"],
  "additionalProperties": false,
  "properties": {
    "format": { "description": "Names the file format. Always open-values-register-coverage-rules.", "const": "open-values-register-coverage-rules" },
    "version": { "description": "The version of this format the file follows. Always 1.0.0.", "const": "1.0.0" },
    "updated": { "description": "The date the rules were last changed, as YYYY-MM-DD.", "type": "string", "format": "date" },
    "note": { "description": "A short paragraph on what the rules do and how a missing rule is read.", "type": "string", "minLength": 1 },
    "statusDefinitions": {
      "description": "The meaning of each coverage status, in a sentence each.",
      "type": "object",
      "required": ["applicable", "not-applicable", "blocked", "unmapped"],
      "additionalProperties": false,
      "properties": {
        "applicable": { "description": "What applicable means: the register's subject clearly covers the decision.", "type": "string", "minLength": 1 },
        "not-applicable": { "description": "What not-applicable means: a reviewed rule says the register cannot supply facts for the decision.", "type": "string", "minLength": 1 },
        "blocked": { "description": "What blocked means: the register applies, but a named prerequisite stops a pass for now.", "type": "string", "minLength": 1 },
        "unmapped": { "description": "What unmapped means: nobody has reviewed the pair yet. It is the default and does not say the register is irrelevant.", "type": "string", "minLength": 1 }
      }
    },
    "registers": {
      "description": "One rule set per register on the shelf. Every shelf register must have exactly one, and no others are allowed.",
      "type": "array",
      "minItems": 1,
      "items": { "$ref": "#/$defs/registerRule" }
    }
  },
  "$defs": {
    "match": {
      "type": "object",
      "minProperties": 1,
      "additionalProperties": false,
      "properties": {
        "realms": { "description": "Matches decisions under any of these top-level taxonomy ids, such as food-and-drink.", "$ref": "#/$defs/values" },
        "fields": { "description": "Matches decisions in any of these fields, the second level of the taxonomy, such as groceries.", "$ref": "#/$defs/values" },
        "families": { "description": "Matches decisions in any of these families, the level below field, such as pet-food.", "$ref": "#/$defs/values" },
        "types": { "description": "Matches decisions whose type is one of these: Products, Services, Organizations, Initiatives or Media.", "$ref": "#/$defs/values" },
        "modes": { "description": "Matches decisions whose mode, how a person comes to have the thing, is one of these, such as buy, rent or hire.", "$ref": "#/$defs/values" },
        "scopes": { "description": "Matches decisions whose taxonomy scope is one of these. Only covered and open decisions are in the matrix.", "$ref": "#/$defs/values" },
        "decisionIds": { "description": "Matches decisions whose taxonomy id is one of these.", "$ref": "#/$defs/values" },
        "cids": { "description": "Matches decisions whose built dataset id (cid) is one of these.", "$ref": "#/$defs/values" }
      }
    },
    "values": {
      "type": "array",
      "minItems": 1,
      "uniqueItems": true,
      "items": { "type": "string", "minLength": 1 }
    },
    "selector": {
      "type": "object",
      "required": ["id", "priority", "status", "reason", "match"],
      "additionalProperties": false,
      "properties": {
        "id": { "description": "A lowercase hyphenated id for the selector, unique within its register. The matrix records it as the reason a status was chosen.", "type": "string", "pattern": "^[a-z0-9]+(?:-[a-z0-9]+)*$" },
        "priority": { "description": "Which selector wins when more than one matches the same decision, from 1 to 999; higher wins. Two winning selectors at the same priority that disagree stop the build. A hand-verified citation on the shelf counts as priority 1000.", "type": "integer", "minimum": 1, "maximum": 999 },
        "status": { "description": "The status this selector gives every decision it matches: applicable, not-applicable or blocked.", "enum": ["applicable", "not-applicable", "blocked"] },
        "reason": { "description": "Why the status holds for the matched decisions, in a sentence. It is copied into the matrix.", "type": "string", "minLength": 1 },
        "match": { "description": "Which taxonomy decisions this selector covers. A decision must satisfy every key given here, and within one key any listed value will do. Every value must exist in the current taxonomy, and the selector must match at least one decision.", "$ref": "#/$defs/match" }
      }
    },
    "registerRule": {
      "type": "object",
      "required": ["registerId", "default", "selectors"],
      "additionalProperties": false,
      "properties": {
        "registerId": { "description": "The id of the register these rules are for, from content/registers.json.", "type": "string", "pattern": "^[a-z0-9]+(?:-[a-z0-9]+)*$" },
        "default": {
          "description": "The status a decision gets from this register when no selector matches it.",
          "type": "object",
          "required": ["status", "reason"],
          "additionalProperties": false,
          "properties": {
            "status": { "description": "Always unmapped, so a pair nobody has reviewed is never reported as not applicable.", "const": "unmapped" },
            "reason": { "description": "A sentence saying the pair has not been reviewed yet.", "type": "string", "minLength": 1 }
          }
        },
        "selectors": { "description": "Reviewed rules that give a status to the decisions they match. May be empty.", "type": "array", "items": { "$ref": "#/$defs/selector" } }
      }
    }
  }
}
